{
  "debugLog": false,
  "permissionReviewLog": false,
  "yoloMode": true,
  "permission": {
    "*": "allow",
    "path": {
      "*": "allow",
      "*.env": "deny",
      "*.env.*": "deny",
      "*.env.example": "allow"
    },
    "read": "allow",
    "write": "allow",
    "edit": "allow",
    "bash": {
      "git *": "ask",
      "git status": "allow"
    },
    "skill": {
      "*": "allow"
    },
    "external_directory": "ask"
  }
}
